"breakouts,acne,pimples,clear skin,smooth skin","achieve clear skin by addressing lifestyle and skincare habits.","Understanding Your Breakout Type|The Anti-Inflammatory Diet Basics|How to Safely Extract a Pimple","Gentle Lymphatic Drainage Massage|Calming Acupressure Points|Manual Face Tapping","Blue Light Therapy Intro|High-Frequency Wand Basics|Cryo Globe Soothing Routine","The 'Shoulder Roll' for Stress Reduction","Dermatologists, Esthetician, Skincare Coach, Skincare Influencer","Individuals with recurring pimples and blackheads."
"flushing,redness,vessels,rosacea,calm skin,even tone","manage skin flushing and redness through a combination of education and soothing techniques.","Identifying Your Rosacea Triggers|Calming Skincare Ingredients Explained|A Gentle Cleansing Routine for Reactive Skin","Pressure-Point Face Mapping|Gentle 'Feathering' Strokes|Manual Lymphatic Drainage","Cryo Globe Facial Routine|LED Light Therapy (Green)|Cooling Jelly Mask Application","The 'Neck Lengthening' Stretch","Dermatologists, Esthetician, Facialists, Skincare Influencer","Individuals experiencing frequent skin flushing and persistent redness, possibly with rosacea."
"dehydration,tight skin,dull skin,hydrated skin,plump skin,glowing skin","restore the skin's moisture barrier and achieve a plump, hydrated complexion.","The Difference Between Dry & Dehydrated Skin|Hyaluronic Acid 101: How to Use It Correctly|Top 5 Hydrating Foods for Glowing Skin","Facial Tapping for Plumping|Hydrating Hand Massage Technique|Gentle Pinch and Release","Hydrating Sheet Mask Application|Facial Steamer Prep|Ultrasonic Spatula Infusion","The 'Chest Opener' for Better Circulation","Dermatologists, Esthetician, Facialists, Skincare Coach, Skincare Influencer","Individuals whose skin feels tight, looks dull, and has fine lines due to lack of water."
"pigmentation,sun spots,dark spots,bright skin,even skin tone","treat and prevent hyperpigmentation, sun spots, and uneven skin tone.","Vitamin C 101: Your Brightening Superstar|How to Use Sunscreen to Prevent Dark Spots|Natural Ingredients for Fading Pigmentation","Brightening Acupressure Points|Gentle Tapping for Circulation|Manual Exfoliation Massage","Micro-Needling Patch Application|LED Light Therapy (Red)|Gentle Exfoliating Brush Technique","The 'Spinal Twist' for Detoxification","Dermatologists, Esthetician, Skincare Coach, Skincare Influencer","Individuals with sun spots, post-acne marks, or an uneven skin tone."
"wrinkles,fine lines,youthful skin,smooth wrinkles","address fine lines and wrinkles by boosting circulation and promoting collagen.","Retinol 101: A Beginner's Guide|How Facial Expressions Cause Wrinkles|Boosting Collagen Naturally Through Diet","Forehead Smoothing Massage|Eye Lifting Exercises|Nasolabial Fold Softening","Gua Sha for Wrinkle Ironing|Facial Cupping for Plumping|Red Light Therapy Wand","The 'Chin Tuck' for a Firmer Jawline","Dermatologists, Facialists, Skincare Influencer","Individuals with fine lines and deeper wrinkles across the face."
"sagging,jowls,double chin,face lift,defined jawline,firm skin,toned skin","lift and firm sagging skin by focusing on muscle toning and improving skin elasticity.","What is Skin Elasticity and How to Improve It?|The Best Facial Exercises for a Natural Jowl Lift|How Your Posture Affects Your Jawline","Natural Jowl Lift Exercise|Jawline Sculpting Massage|Cheekbone Lifting Push","Jawline Sculpting with Gua Sha|Facial Cupping for Firmness|Microcurrent Device Basics","The 'Posture Reset' for a Defined Profile","Dermatologists, Facialists, Skincare Influencer","Individuals experiencing loss of firmness, especially around the jawline and cheeks."
"enlarged pores,blackheads,clogged pores,refined pores,clear pores,smooth texture","refine the appearance of pores and clear blackheads for a smoother complexion.","What Really Causes Enlarged Pores?|The Truth About Pore Strips|Top 3 Ingredients for Clear Pores","Gentle 'Pore Rolling' Massage|The Double Cleanse Method Explained|Manual Lymphatic Drainage for Detox","Ultrasonic Spatula Extraction|Clay Mask Application Technique|Salicylic Acid Peel Prep","The 'Face Down' De-stress Pose","Dermatologists, Esthetician, Skincare Coach, Skincare Influencer","Individuals with visibly enlarged pores, blackheads, and a congested T-zone."
"uneven texture,rough skin,bumpy skin,smooth skin,glass skin","achieve a smooth, 'glass skin' texture by addressing roughness and bumps.","Chemical vs. Physical Exfoliation Explained|The Role of Hydration in Skin Texture|How to Repair a Damaged Skin Barrier","Gentle Circular Buffing Massage|The '7 Skin' Hydration Method|Facial Tapping for Glow","Dermaplaning Basics at Home|Glycolic Acid Toner Application|Using a Konjac Sponge Correctly","The 'Open Heart' Chest Stretch","Dermatologists, Esthetician, Facialists, Skincare Influencer","Individuals with rough, bumpy, or uneven skin texture."
"volume loss,hollow cheeks,sunken temples,plump skin,facial volume","restore youthful volume and plumpness to areas like the cheeks and temples.","What is Facial Fat Pad Loss?|Top 3 Plumping Skincare Ingredients|How Diet Affects Facial Volume","Cheek Plumping 'Flicking' Technique|Buccal (Intra-Oral) Massage Basics|Temple Smoothing Massage","Microcurrent for Muscle Tone|Facial Cupping for Cheeks|Using a Jade Roller for Plumping","The 'Head Up' Neck Lengthener","Facialists, Skincare Influencer","Individuals noticing a loss of facial volume, leading to hollow cheeks or temples."
"forehead lines,forehead wrinkles,smooth forehead","smooth horizontal expression lines by relaxing the frontalis muscle.","Reading Your Forehead Lines: What They Mean|The 'Tapping' Technique for Releasing Tension|Frownies vs. Botox: A Non-Invasive Approach","Forehead Muscle Relaxation Massage|'Brow Drag' Tension Release|Scalp Massage for Forehead","Gua Sha 'Combing' Technique|Forehead Cupping|Acupressure Pen for Tension","The 'Shoulder Blade Squeeze'","Dermatologists, Facialists, Skincare Influencer","Individuals with horizontal expression lines across the forehead."
"frown lines,eleven lines,interbrow,glabellar lines,relax brows","release deep tension in the glabellar region (between the brows) to soften 'eleven' lines.","Understanding Your '11s': The Corrugator Muscle|Acupressure Points for Releasing Frown Lines|The 'Brow Pinch' Relaxation Technique","'Brow Pinch' Relaxation|Interbrow 'Ironing' Massage|Temple Rub for Tension","Acupressure at LI4 & Yin Tang|Gua Sha for Glabellar Lines|Small Facial Cups","The 'Neck & Shoulder' Stretch","Dermatologists, Facialists, Skincare Influencer","Individuals with vertical 'eleven' lines between the eyebrows."
"crow's feet,eye wrinkles,eye lines,bright eyes","soften expression lines around the eyes with gentle massage and hydration.","Are Your Eyes Dehydrated? The Link to Wrinkles|The 'Orbital Tap' for Boosting Circulation|Top 3 Eye Cream Ingredients for Expression Lines","Gentle Orbital Tapping|'Eye Smile' Strengthening Exercise|Pressure Point for Eye Strain","Cooling Spoon De-Puffing Massage|Mini Gua Sha for Eyes|Cryo Globe Eye Massage","The 'Eagle Arms' Shoulder Stretch","Dermatologists, Esthetician, Facialists, Skincare Influencer","Individuals with fine lines radiating from the outer corners of the eyes."
"nasolabial folds,smile lines,lifted cheeks,sculpted cheeks","soften smile lines by working on cheek volume and releasing facial tension.","The Cheek Plumping Massage Technique|How Your Sleeping Position Affects Smile Lines|An Introduction to Buccal (Intra-Oral) Massage","Buccal (Intra-Oral) Massage Basics|Cheek Plumping 'Flicking' Technique|'O' Shape Face Yoga Exercise","Gua Sha Cheek Sculpting|Facial Cupping for Cheeks|Kansa Wand Massage","The 'Pelvic Tilt' for Posture","Facialists, Skincare Influencer","Individuals with prominent creases running from the nose to the corners of the mouth."
"marionette lines,sad mouth,lifted mouth corners","lift the corners of the mouth by releasing tension in the lower face and jaw.","Jaw Tension & Its Link to Marionette Lines|The 'DAO Muscle' Release for a Happier Smile|3 Exercises to Lift the Corners of Your Mouth","DAO Muscle Release Massage|'Jaw Hook' Exercise|Lower Face Toning","Jawline Lifting with Gua Sha|Small Cupping for Lip Corners|Acupressure for DAO Muscle","The 'Cat-Cow' Spinal Flex","Facialists, Skincare Influencer","Individuals with lines running downwards from the corners of the mouth."
"neck lines,tech neck,smooth neck,youthful neck","address horizontal neck lines ('tech neck') through posture correction and targeted massage.","What is 'Tech Neck' and How it Affects Your Skin|The 'Neck Roll' Stretching Routine for Smoother Skin|Best Skincare Ingredients for the Neck & Décolleté","'Tech Neck' Posture Correction Exercises|Platysma Band Stretching|Upward Neck Massage Technique","Gua Sha for Neck|Neck Taping Basics|Body Brush for Neck","The 'Doorway' Chest Stretch","Facialists, Skincare Coach, Skincare Influencer","Individuals with horizontal wrinkles or 'tech neck' bands around the neck."
"lip lines,smoker's lines,plump lips,smooth lips","soften vertical lines around the mouth with hydration and gentle exercises.","Hydrating Your Lips from Within: The Basics|The 'Lip Pucker' Exercise for a Smoother Pout|Gentle Tapping to Boost Lip Circulation","'Lip Pucker' Exercise|Gentle Tapping Around the Mouth|'O and E' Vowel Shapes","Silicone Lip Patch Application|Mini Cupping for Lips|Red Light Therapy for Lips","The 'Tongue Press' Exercise","Facialists, Skincare Influencer","Individuals with fine, vertical lines above and around the lips (smoker's lines)."
"dark circles,circles,bright eyes","address dark circles by improving circulation and depuffing the delicate eye area.","The 3 Types of Dark Circles (and how to treat them)|Top 5 Eye Cream Ingredients for Brightening|Gentle Tapping Massage for Under-Eye Circulation","Under-Eye Tapping Massage|'Temple Rub' for Eye Strain|Manual Eye Lymphatic Drainage","Cooling Eye Mask Routine|Cryo Globe Eye Massage|Kansa Wand for Eyes","The 'Palming' Relaxation Technique","Dermatologists, Facialists, Skincare Influencer","Individuals with persistent dark circles or shadows under the eyes."
"puffiness,eye bags,facial swelling,de-puff,defined face,sculpted jawline","reduce morning puffiness and facial swelling through lymphatic drainage and lifestyle habits.","The Lymphatic System & Your Face: A Simple Guide|A 5-Minute Morning De-Puffing Routine|Top 5 Foods That Cause & Reduce Facial Puffiness","5-Minute Morning De-Puffing Routine|Manual Full Face Lymphatic Drainage|'Lion's Breath' Yoga","Cryo Stick Eye Massage|Gua Sha for Lymphatic Flow|Facial Cupping for De-Puffing","The 'Legs Up the Wall' Pose","Dermatologists, Facialists, Skincare Coach, Skincare Influencer","Individuals who wake up with puffy eyes or a generally swollen face."

